ffffffc025982600 945326054 S Bo:2:002:5 -115 62 = d286e6c7 8cfed286 e6c78cfe 08004500 00303e92 40004011 cf660a58 a8e7ddb3
ffffffc025982600 945326281 C Bo:2:002:5 0 62 >
ffffffc025982800 950333977 S Bo:2:002:5 -115 62 = d286e6c7 8cfed286 e6c78cfe 08004500 00304822 40004011 c5e60a58 a8e7ddb3
ffffffc025982800 950334296 C Bo:2:002:5 0 62 >
ffffffc0643c5200 952049818 S Bo:2:002:3 -115 7 = 41542b43 53510d
ffffffc0643c5200 952050312 C Bo:2:002:3 0 7 >
ffffffc064299e00 952054018 C Bi:2:002:4 0 21 = 0d0a2b43 53513a20 31382c39 390d0a0d 0a4f4b0d 0a
ffffffc064299e00 952054097 S Bi:2:002:4 -115 4096 <
ffffffc0643c5200 952054662 S Bo:2:002:3 -115 19 = 41542b43 4f50533d 332c323b 2b434f50 533f0d
ffffffc0643c5200 952054762 C Bo:2:002:3 0 19 >
ffffffc064299f00 952062992 C Bi:2:002:4 0 30 = 0d0a2b43 4f50533a 20302c32 2c223436 30303022 2c370d0a 0d0a4f4b 0d0a
ffffffc064299f00 952063015 S Bi:2:002:4 -115 4096 <
ffffffc0643c5200 952063449 S Bo:2:002:3 -115 8 = 41542b51 4353510d
ffffffc0643c5200 952063660 C Bo:2:002:3 0 8 >
ffffffc0643c5000 952070783 C Bi:2:002:4 0 38 = 0d0a2b51 4353513a 20224c54 45222c37 382c2d31 30352c31 34362c2d 31310d0a
ffffffc0643c5000 952070806 S Bi:2:002:4 -115 4096 <
ffffffc0643c5200 952071451 S Bo:2:002:3 -115 10 = 41542b43 47524547 3f0d
ffffffc0643c5200 952071681 C Bo:2:002:3 0 10 >
ffffffc064299b00 952072038 C Ii:2:002:5 0:256 10 = a1200000 02000200 0000
ffffffc064299b00 952072052 S Ii:2:002:5 -115:256 10 <
ffffffc0643c5100 952079829 C Bi:2:002:4 0 40 = 0d0a2b43 47524547 3a20322c 312c2231 31423222 2c223739 39363538 37222c37
ffffffc0643c5100 952079911 S Bi:2:002:4 -115 4096 <
ffffffc064299b00 952104053 C Ii:2:002:5 0:256 10 = a1200000 02000200 0000
ffffffc064299b00 952104100 S Ii:2:002:5 -115:256 10 <
ffffffc064299b00 952136113 C Ii:2:002:5 0:256 10 = a1200000 02000200 0000
ffffffc064299b00 952136176 S Ii:2:002:5 -115:256 10 <
ffffffc025982300 955340190 S Bo:2:002:5 -115 62 = d286e6c7 8cfed286 e6c78cfe 08004500 0030430f 40004011 cae90a58 a8e7ddb3
ffffffc025982300 955340393 C Bo:2:002:5 0 62 >
ffffffc025982f00 960346170 S Bo:2:002:5 -115 62 = d286e6c7 8cfed286 e6c78cfe 08004500 003050c7 40004011 bd410a58 a8e7ddb3
ffffffc025982f00 960346397 C Bo:2:002:5 0 62 >
ffffffc0643c5200 972101307 S Bo:2:002:3 -115 7 = 41542b43 53510d
ffffffc0643c5200 972101581 C Bo:2:002:3 0 7 >
ffffffc064299e00 972106355 C Bi:2:002:4 0 21 = 0d0a2b43 53513a20 31382c39 390d0a0d 0a4f4b0d 0a
ffffffc064299e00 972106431 S Bi:2:002:4 -115 4096 <
ffffffc0643c5200 972107781 S Bo:2:002:3 -115 19 = 41542b43 4f50533d 332c323b 2b434f50 533f0d
ffffffc0643c5200 972108025 C Bo:2:002:3 0 19 >
ffffffc064299f00 972114101 C Bi:2:002:4 0 30 = 0d0a2b43 4f50533a 20302c32 2c223436 30303022 2c370d0a 0d0a4f4b 0d0a
ffffffc064299f00 972114172 S Bi:2:002:4 -115 4096 <
ffffffc0643c5200 972115105 S Bo:2:002:3 -115 8 = 41542b51 4353510d
ffffffc0643c5200 972115293 C Bo:2:002:3 0 8 >
ffffffc0643c5000 972121851 C Bi:2:002:4 0 38 = 0d0a2b51 4353513a 20224c54 45222c37 382c2d31 30352c31 34332c2d 31310d0a
ffffffc0643c5000 972121943 S Bi:2:002:4 -115 4096 <
ffffffc0643c5200 972123185 S Bo:2:002:3 -115 10 = 41542b43 47524547 3f0d
ffffffc0643c5200 972123536 C Bo:2:002:3 0 10 >
ffffffc0643c5100 972131141 C Bi:2:002:4 0 40 = 0d0a2b43 47524547 3a20322c 312c2231 31423222 2c223739 39363538 37222c37
ffffffc0643c5100 972131260 S Bi:2:002:4 -115 4096 <
ffffffc064299b00 972136164 C Ii:2:002:5 0:256 10 = a1200000 02000200 0000
ffffffc064299b00 972136231 S Ii:2:002:5 -115:256 10 <
ffffffc064299b00 972168140 C Ii:2:002:5 0:256 10 = a1200000 02000200 0000
ffffffc064299b00 972168201 S Ii:2:002:5 -115:256 10 <
ffffffc043c5cd00 972903018 S Bo:2:002:5 -115 98 = d286e6c7 8cfed286 e6c78cfe 08004500 0054fba6 40004001 7bb30a58 a8e70808
ffffffc043c5cd00 972903309 C Bo:2:002:5 0 98 >
ffffffc043c5cb00 973917349 S Bo:2:002:5 -115 98 = d286e6c7 8cfed286 e6c78cfe 08004500 0054fc2a 40004001 7b2f0a58 a8e70808
ffffffc043c5cb00 973917597 C Bo:2:002:5 0 98 >
ffffffc043c5cc00 974930699 S Bo:2:002:5 -115 98 = d286e6c7 8cfed286 e6c78cfe 08004500 0054fc7f 40004001 7ada0a58 a8e70808
ffffffc043c5cc00 974930942 C Bo:2:002:5 0 98 >
ffffffc043c5cc00 975943967 S Bo:2:002:5 -115 98 = d286e6c7 8cfed286 e6c78cfe 08004500 0054fd45 40004001 7a140a58 a8e70808
ffffffc043c5cc00 975944151 C Bo:2:002:5 0 98 >
ffffffc043c5cb00 976957225 S Bo:2:002:5 -115 98 = d286e6c7 8cfed286 e6c78cfe 08004500 0054fe1e 40004001 793b0a58 a8e70808
ffffffc043c5cb00 976957399 C Bo:2:002:5 0 98 >
ffffffc043c5cd00 977970508 S Bo:2:002:5 -115 98 = d286e6c7 8cfed286 e6c78cfe 08004500 0054fe9c 40004001 78bd0a58 a8e70808
ffffffc043c5cd00 977970648 C Bo:2:002:5 0 98 >
ffffffc043c5cd00 978983936 S Bo:2:002:5 -115 98 = d286e6c7 8cfed286 e6c78cfe 08004500 0054ff5f 40004001 77fa0a58 a8e70808
ffffffc043c5cd00 978984167 C Bo:2:002:5 0 98 >
ffffffc043c5cb00 979997230 S Bo:2:002:5 -115 98 = d286e6c7 8cfed286 e6c78cfe 08004500 0054ff86 40004001 77d30a58 a8e70808
ffffffc043c5cb00 979997414 C Bo:2:002:5 0 98 >
ffffffc043c5cc00 981010550 S Bo:2:002:5 -115 98 = d286e6c7 8cfed286 e6c78cfe 08004500 0054ffa2 40004001 77b70a58 a8e70808
ffffffc043c5cc00 981010878 C Bo:2:002:5 0 98 >
ffffffc043c5cc00 982023953 S Bo:2:002:5 -115 98 = d286e6c7 8cfed286 e6c78cfe 08004500 00540060 40004001 76fa0a58 a8e70808
ffffffc043c5cc00 982024257 C Bo:2:002:5 0 98 >
ffffffc043c5cb00 983037228 S Bo:2:002:5 -115 98 = d286e6c7 8cfed286 e6c78cfe 08004500 005400ca 40004001 76900a58 a8e70808
ffffffc043c5cb00 983037410 C Bo:2:002:5 0 98 >
ffffffc0643c5200 992153730 S Bo:2:002:3 -115 7 = 41542b43 53510d
ffffffc0643c5200 992153918 C Bo:2:002:3 0 7 >
ffffffc064299e00 992157646 C Bi:2:002:4 0 21 = 0d0a2b43 53513a20 31382c39 390d0a0d 0a4f4b0d 0a
ffffffc064299e00 992157709 S Bi:2:002:4 -115 4096 <
ffffffc0643c5200 992158870 S Bo:2:002:3 -115 19 = 41542b43 4f50533d 332c323b 2b434f50 533f0d
ffffffc0643c5200 992159022 C Bo:2:002:3 0 19 >
ffffffc064299f00 992165483 C Bi:2:002:4 0 30 = 0d0a2b43 4f50533a 20302c32 2c223436 30303022 2c370d0a 0d0a4f4b 0d0a
ffffffc064299f00 992165552 S Bi:2:002:4 -115 4096 <
ffffffc0643c5200 992166469 S Bo:2:002:3 -115 8 = 41542b51 4353510d
ffffffc0643c5200 992166692 C Bo:2:002:3 0 8 >
ffffffc064299b00 992168114 C Ii:2:002:5 0:256 10 = a1200000 02000200 0000
ffffffc064299b00 992168154 S Ii:2:002:5 -115:256 10 <
ffffffc0643c5000 992168262 C Bi:2:002:4 0 38 = 0d0a2b51 4353513a 20224c54 45222c37 382c2d31 30352c31 35382c2d 31310d0a
ffffffc0643c5000 992168308 S Bi:2:002:4 -115 4096 <
ffffffc0643c5200 992169594 S Bo:2:002:3 -115 10 = 41542b43 47524547 3f0d
ffffffc0643c5200 992169790 C Bo:2:002:3 0 10 >
ffffffc0643c5100 992174957 C Bi:2:002:4 0 40 = 0d0a2b43 47524547 3a20322c 312c2231 31423222 2c223739 39363538 37222c37
ffffffc0643c5100 992175081 S Bi:2:002:4 -115 4096 <
ffffffc064299b00 992200053 C Ii:2:002:5 0:256 10 = a1200000 02000200 0000
ffffffc064299b00 992200113 S Ii:2:002:5 -115:256 10 <
ffffffc064299b00 992232019 C Ii:2:002:5 0:256 10 = a1200000 02000200 0000
ffffffc064299b00 992232054 S Ii:2:002:5 -115:256 10 <
ffffffc0643c5200 1012196838 S Bo:2:002:3 -115 7 = 41542b43 53510d
ffffffc0643c5200 1012197054 C Bo:2:002:3 0 7 >
ffffffc064299e00 1012200649 C Bi:2:002:4 0 21 = 0d0a2b43 53513a20 31382c39 390d0a0d 0a4f4b0d 0a
ffffffc064299e00 1012200716 S Bi:2:002:4 -115 4096 <
ffffffc0643c5200 1012201879 S Bo:2:002:3 -115 19 = 41542b43 4f50533d 332c323b 2b434f50 533f0d
ffffffc0643c5200 1012202020 C Bo:2:002:3 0 19 >
ffffffc064299f00 1012209646 C Bi:2:002:4 0 30 = 0d0a2b43 4f50533a 20302c32 2c223436 30303022 2c370d0a 0d0a4f4b 0d0a
ffffffc064299f00 1012209705 S Bi:2:002:4 -115 4096 <
ffffffc0643c5200 1012210722 S Bo:2:002:3 -115 8 = 41542b51 4353510d
ffffffc0643c5200 1012210899 C Bo:2:002:3 0 8 >
ffffffc0643c5000 1012217270 C Bi:2:002:4 0 38 = 0d0a2b51 4353513a 20224c54 45222c37 382c2d31 30352c31 35392c2d 31310d0a
ffffffc0643c5000 1012217330 S Bi:2:002:4 -115 4096 <
ffffffc0643c5200 1012218718 S Bo:2:002:3 -115 10 = 41542b43 47524547 3f0d
ffffffc0643c5200 1012218915 C Bo:2:002:3 0 10 >
ffffffc0643c5100 1012224692 C Bi:2:002:4 0 40 = 0d0a2b43 47524547 3a20322c 312c2231 31423222 2c223739 39363538 37222c37
ffffffc0643c5100 1012224802 S Bi:2:002:4 -115 4096 <
ffffffc064299b00 1012232181 C Ii:2:002:5 0:256 10 = a1200000 02000200 0000
ffffffc064299b00 1012232251 S Ii:2:002:5 -115:256 10 <
ffffffc064299b00 1012264131 C Ii:2:002:5 0:256 10 = a1200000 02000200 0000
ffffffc064299b00 1012264185 S Ii:2:002:5 -115:256 10 <
ffffffc025982c00 1018507287 S Bo:2:002:5 -115 98 = d286e6c7 8cfed286 e6c78cfe 08004500 00540e5d 40004001 68fd0a58 a8e70808
ffffffc025982c00 1018507541 C Bo:2:002:5 0 98 >
ffffffc025982b00 1019517749 S Bo:2:002:5 -115 98 = d286e6c7 8cfed286 e6c78cfe 08004500 00540eea 40004001 68700a58 a8e70808
ffffffc025982b00 1019518087 C Bo:2:002:5 0 98 >
ffffffc025982600 1020530731 S Bo:2:002:5 -115 98 = d286e6c7 8cfed286 e6c78cfe 08004500 00540f03 40004001 68570a58 a8e70808
ffffffc025982600 1020530896 C Bo:2:002:5 0 98 >
ffffffc025982a00 1021544040 S Bo:2:002:5 -115 98 = d286e6c7 8cfed286 e6c78cfe 08004500 00540f3f 40004001 681b0a58 a8e70808
ffffffc025982a00 1021544273 C Bo:2:002:5 0 98 >
ffffffc025982500 1022557356 S Bo:2:002:5 -115 98 = d286e6c7 8cfed286 e6c78cfe 08004500 00540ffb 40004001 675f0a58 a8e70808
ffffffc025982500 1022557520 C Bo:2:002:5 0 98 >
ffffffc025982300 1023570978 S Bo:2:002:5 -115 98 = d286e6c7 8cfed286 e6c78cfe 08004500 00541085 40004001 66d50a58 a8e70808
ffffffc025982300 1023571163 C Bo:2:002:5 0 98 >
ffffffc025982900 1024584049 S Bo:2:002:5 -115 98 = d286e6c7 8cfed286 e6c78cfe 08004500 005411ab 40004001 65af0a58 a8e70808
ffffffc025982900 1024584296 C Bo:2:002:5 0 98 >
ffffffc025982900 1025597429 S Bo:2:002:5 -115 98 = d286e6c7 8cfed286 e6c78cfe 08004500 00541292 40004001 64c80a58 a8e70808
ffffffc025982900 1025597684 C Bo:2:002:5 0 98 >
ffffffc025982300 1026610757 S Bo:2:002:5 -115 98 = d286e6c7 8cfed286 e6c78cfe 08004500 0054134c 40004001 640e0a58 a8e70808
ffffffc025982300 1026611134 C Bo:2:002:5 0 98 >
ffffffc025982500 1027623987 S Bo:2:002:5 -115 98 = d286e6c7 8cfed286 e6c78cfe 08004500 00541477 40004001 62e30a58 a8e70808
ffffffc025982500 1027624256 C Bo:2:002:5 0 98 >
ffffffc025982a00 1028637300 S Bo:2:002:5 -115 98 = d286e6c7 8cfed286 e6c78cfe 08004500 0054156f 40004001 61eb0a58 a8e70808
ffffffc025982a00 1028637545 C Bo:2:002:5 0 98 >
ffffffc025982600 1029650687 S Bo:2:002:5 -115 98 = d286e6c7 8cfed286 e6c78cfe 08004500 00541621 40004001 61390a58 a8e70808
ffffffc025982600 1029650927 C Bo:2:002:5 0 98 >
ffffffc025982100 1030664120 S Bo:2:002:5 -115 98 = d286e6c7 8cfed286 e6c78cfe 08004500 00541730 40004001 602a0a58 a8e70808
ffffffc025982100 1030664521 C Bo:2:002:5 0 98 >
ffffffc025982200 1031677454 S Bo:2:002:5 -115 98 = d286e6c7 8cfed286 e6c78cfe 08004500 005417d9 40004001 5f810a58 a8e70808
ffffffc025982200 1031677686 C Bo:2:002:5 0 98 >
ffffffc0643c5200 1032246758 S Bo:2:002:3 -115 7 = 41542b43 53510d
ffffffc0643c5200 1032247070 C Bo:2:002:3 0 7 >
ffffffc064299e00 1032249982 C Bi:2:002:4 0 21 = 0d0a2b43 53513a20 31372c39 390d0a0d 0a4f4b0d 0a
ffffffc064299e00 1032250065 S Bi:2:002:4 -115 4096 <
ffffffc0643c5200 1032251070 S Bo:2:002:3 -115 19 = 41542b43 4f50533d 332c323b 2b434f50 533f0d
ffffffc0643c5200 1032251310 C Bo:2:002:3 0 19 >
ffffffc064299f00 1032257105 C Bi:2:002:4 0 30 = 0d0a2b43 4f50533a 20302c32 2c223436 30303022 2c370d0a 0d0a4f4b 0d0a
ffffffc064299f00 1032257178 S Bi:2:002:4 -115 4096 <
ffffffc0643c5200 1032258006 S Bo:2:002:3 -115 8 = 41542b51 4353510d
ffffffc0643c5200 1032258175 C Bo:2:002:3 0 8 >
ffffffc0643c5000 1032259605 C Bi:2:002:4 0 38 = 0d0a2b51 4353513a 20224c54 45222c37 392c2d31 30352c31 34382c2d 31310d0a
ffffffc0643c5000 1032259669 S Bi:2:002:4 -115 4096 <
ffffffc0643c5200 1032260838 S Bo:2:002:3 -115 10 = 41542b43 47524547 3f0d
ffffffc0643c5200 1032261056 C Bo:2:002:3 0 10 >
ffffffc064299b00 1032264060 C Ii:2:002:5 0:256 10 = a1200000 02000200 0000
ffffffc064299b00 1032264111 S Ii:2:002:5 -115:256 10 <
ffffffc0643c5100 1032265634 C Bi:2:002:4 0 40 = 0d0a2b43 47524547 3a20322c 312c2231 31423222 2c223739 39363538 37222c37
ffffffc0643c5100 1032265727 S Bi:2:002:4 -115 4096 <
ffffffc064299b00 1032296155 C Ii:2:002:5 0:256 10 = a1200000 02000200 0000
ffffffc064299b00 1032296221 S Ii:2:002:5 -115:256 10 <
ffffffc064299b00 1032328119 C Ii:2:002:5 0:256 10 = a1200000 02000200 0000
ffffffc064299b00 1032328164 S Ii:2:002:5 -115:256 10 <
ffffffc025982e00 1032690705 S Bo:2:002:5 -115 98 = d286e6c7 8cfed286 e6c78cfe 08004500 00541852 40004001 5f080a58 a8e70808
ffffffc025982e00 1032691014 C Bo:2:002:5 0 98 >
ffffffc025982f00 1033703939 S Bo:2:002:5 -115 98 = d286e6c7 8cfed286 e6c78cfe 08004500 0054188b 40004001 5ecf0a58 a8e70808
ffffffc025982f00 1033704260 C Bo:2:002:5 0 98 >
ffffffc025982200 1034717308 S Bo:2:002:5 -115 98 = d286e6c7 8cfed286 e6c78cfe 08004500 005419a9 40004001 5db10a58 a8e70808
ffffffc025982200 1034717643 C Bo:2:002:5 0 98 >
ffffffc025982100 1035730633 S Bo:2:002:5 -115 98 = d286e6c7 8cfed286 e6c78cfe 08004500 00541a0f 40004001 5d4b0a58 a8e70808
ffffffc025982100 1035731025 C Bo:2:002:5 0 98 >
ffffffc025982b00 1036743943 S Bo:2:002:5 -115 98 = d286e6c7 8cfed286 e6c78cfe 08004500 00541ae5 40004001 5c750a58 a8e70808
ffffffc025982b00 1036744260 C Bo:2:002:5 0 98 >
ffffffc025982c00 1037757077 S Bo:2:002:5 -115 98 = d286e6c7 8cfed286 e6c78cfe 08004500 00541bdd 40004001 5b7d0a58 a8e70808
ffffffc025982c00 1037757381 C Bo:2:002:5 0 98 >
ffffffc025982600 1038770627 S Bo:2:002:5 -115 98 = d286e6c7 8cfed286 e6c78cfe 08004500 00541cc0 40004001 5a9a0a58 a8e70808
ffffffc025982600 1038771011 C Bo:2:002:5 0 98 >
ffffffc025982a00 1039783952 S Bo:2:002:5 -115 98 = d286e6c7 8cfed286 e6c78cfe 08004500 00541cfa 40004001 5a600a58 a8e70808
ffffffc025982a00 1039784260 C Bo:2:002:5 0 98 >
ffffffc025982500 1040797172 S Bo:2:002:5 -115 98 = d286e6c7 8cfed286 e6c78cfe 08004500 00541d5f 40004001 59fb0a58 a8e70808
ffffffc025982500 1040797510 C Bo:2:002:5 0 98 >
ffffffc025982300 1041810559 S Bo:2:002:5 -115 98 = d286e6c7 8cfed286 e6c78cfe 08004500 00541da8 40004001 59b20a58 a8e70808
ffffffc025982300 1041810793 C Bo:2:002:5 0 98 >
ffffffc025982900 1042823980 S Bo:2:002:5 -115 98 = d286e6c7 8cfed286 e6c78cfe 08004500 00541e0e 40004001 594c0a58 a8e70808
ffffffc025982900 1042824168 C Bo:2:002:5 0 98 >
ffffffc025982900 1043837294 S Bo:2:002:5 -115 98 = d286e6c7 8cfed286 e6c78cfe 08004500 00541f05 40004001 58550a58 a8e70808
ffffffc025982900 1043837544 C Bo:2:002:5 0 98 >
ffffffc025982300 1044850699 S Bo:2:002:5 -115 98 = d286e6c7 8cfed286 e6c78cfe 08004500 00541f90 40004001 57ca0a58 a8e70808
ffffffc025982300 1044850922 C Bo:2:002:5 0 98 >
ffffffc025982500 1045863936 S Bo:2:002:5 -115 98 = d286e6c7 8cfed286 e6c78cfe 08004500 00541f99 40004001 57c10a58 a8e70808
ffffffc025982500 1045864180 C Bo:2:002:5 0 98 >
ffffffc07f122800 1046877168 S Bo:2:002:5 -115 98 = d286e6c7 8cfed286 e6c78cfe 08004500 0054209f 40004001 56bb0a58 a8e70808
ffffffc07f122800 1046877505 C Bo:2:002:5 0 98 >
ffffffc07f122b00 1047890538 S Bo:2:002:5 -115 98 = d286e6c7 8cfed286 e6c78cfe 08004500 005420ef 40004001 566b0a58 a8e70808
ffffffc07f122b00 1047890801 C Bo:2:002:5 0 98 >
ffffffc07f122d00 1048903869 S Bo:2:002:5 -115 98 = d286e6c7 8cfed286 e6c78cfe 08004500 005421a0 40004001 55ba0a58 a8e70808
ffffffc07f122d00 1048904131 C Bo:2:002:5 0 98 >
ffffffc07f122a00 1049917263 S Bo:2:002:5 -115 98 = d286e6c7 8cfed286 e6c78cfe 08004500 005422c8 40004001 54920a58 a8e70808
ffffffc07f122a00 1049917643 C Bo:2:002:5 0 98 >
ffffffc07f122100 1050930584 S Bo:2:002:5 -115 98 = d286e6c7 8cfed286 e6c78cfe 08004500 005423ca 40004001 53900a58 a8e70808
ffffffc07f122100 1050930806 C Bo:2:002:5 0 98 >
ffffffc07f122900 1051943951 S Bo:2:002:5 -115 98 = d286e6c7 8cfed286 e6c78cfe 08004500 0054245f 40004001 52fb0a58 a8e70808
ffffffc07f122900 1051944256 C Bo:2:002:5 0 98 >
ffffffc0643c5200 1052287169 S Bo:2:002:3 -115 7 = 41542b43 53510d
ffffffc0643c5200 1052287468 C Bo:2:002:3 0 7 >
ffffffc064299e00 1052291905 C Bi:2:002:4 0 21 = 0d0a2b43 53513a20 31372c39 390d0a0d 0a4f4b0d 0a
ffffffc064299e00 1052291979 S Bi:2:002:4 -115 4096 <
ffffffc0643c5200 1052292990 S Bo:2:002:3 -115 19 = 41542b43 4f50533d 332c323b 2b434f50 533f0d
ffffffc0643c5200 1052293167 C Bo:2:002:3 0 19 >
ffffffc064299b00 1052296031 C Ii:2:002:5 0:256 10 = a1200000 02000200 0000
ffffffc064299b00 1052296067 S Ii:2:002:5 -115:256 10 <
ffffffc064299f00 1052299648 C Bi:2:002:4 0 30 = 0d0a2b43 4f50533a 20302c32 2c223436 30303022 2c370d0a 0d0a4f4b 0d0a
ffffffc064299f00 1052299705 S Bi:2:002:4 -115 4096 <
ffffffc0643c5200 1052300681 S Bo:2:002:3 -115 8 = 41542b51 4353510d
ffffffc0643c5200 1052300903 C Bo:2:002:3 0 8 >
ffffffc0643c5000 1052306148 C Bi:2:002:4 0 38 = 0d0a2b51 4353513a 20224c54 45222c37 392c2d31 30352c31 34362c2d 31310d0a
ffffffc0643c5000 1052306209 S Bi:2:002:4 -115 4096 <
ffffffc0643c5200 1052307546 S Bo:2:002:3 -115 10 = 41542b43 47524547 3f0d
ffffffc0643c5200 1052307789 C Bo:2:002:3 0 10 >
ffffffc0643c5100 1052313834 C Bi:2:002:4 0 40 = 0d0a2b43 47524547 3a20322c 312c2231 31423222 2c223739 39363538 37222c37
ffffffc0643c5100 1052313952 S Bi:2:002:4 -115 4096 <
ffffffc064299b00 1052328147 C Ii:2:002:5 0:256 10 = a1200000 02000200 0000
ffffffc064299b00 1052328221 S Ii:2:002:5 -115:256 10 <
ffffffc064299b00 1052360123 C Ii:2:002:5 0:256 10 = a1200000 02000200 0000
ffffffc064299b00 1052360170 S Ii:2:002:5 -115:256 10 <
ffffffc07f122800 1052957394 S Bo:2:002:5 -115 98 = d286e6c7 8cfed286 e6c78cfe 08004500 00542542 40004001 52180a58 a8e70808
ffffffc07f122800 1052957762 C Bo:2:002:5 0 98 >
ffffffc07f122200 1053970650 S Bo:2:002:5 -115 98 = d286e6c7 8cfed286 e6c78cfe 08004500 00542548 40004001 52120a58 a8e70808
ffffffc07f122200 1053970932 C Bo:2:002:5 0 98 >
ffffffc07f122200 1054983973 S Bo:2:002:5 -115 98 = d286e6c7 8cfed286 e6c78cfe 08004500 005425b2 40004001 51a80a58 a8e70808
ffffffc07f122200 1054984185 C Bo:2:002:5 0 98 >
ffffffc07f122800 1055997279 S Bo:2:002:5 -115 98 = d286e6c7 8cfed286 e6c78cfe 08004500 00542620 40004001 513a0a58 a8e70808
ffffffc07f122800 1055997556 C Bo:2:002:5 0 98 >
ffffffc07f122b00 1057010589 S Bo:2:002:5 -115 98 = d286e6c7 8cfed286 e6c78cfe 08004500 005426c6 40004001 50940a58 a8e70808
ffffffc07f122b00 1057010804 C Bo:2:002:5 0 98 >
ffffffc07f122d00 1058023880 S Bo:2:002:5 -115 98 = d286e6c7 8cfed286 e6c78cfe 08004500 00542732 40004001 50280a58 a8e70808
ffffffc07f122d00 1058024174 C Bo:2:002:5 0 98 >
ffffffc07f122a00 1059037154 S Bo:2:002:5 -115 98 = d286e6c7 8cfed286 e6c78cfe 08004500 0054278a 40004001 4fd00a58 a8e70808
ffffffc07f122a00 1059037419 C Bo:2:002:5 0 98 >
ffffffc07f122300 1060050450 S Bo:2:002:5 -115 98 = d286e6c7 8cfed286 e6c78cfe 08004500 005428b7 40004001 4ea30a58 a8e70808
ffffffc07f122300 1060050704 C Bo:2:002:5 0 98 >
ffffffc07f122900 1061063846 S Bo:2:002:5 -115 98 = d286e6c7 8cfed286 e6c78cfe 08004500 005429da 40004001 4d800a58 a8e70808
ffffffc07f122900 1061064146 C Bo:2:002:5 0 98 >
ffffffc07f122900 1062077062 S Bo:2:002:5 -115 98 = d286e6c7 8cfed286 e6c78cfe 08004500 00542ae8 40004001 4c720a58 a8e70808
ffffffc07f122900 1062077388 C Bo:2:002:5 0 98 >
ffffffc07f122100 1063090388 S Bo:2:002:5 -115 98 = d286e6c7 8cfed286 e6c78cfe 08004500 00542bc8 40004001 4b920a58 a8e70808
ffffffc07f122100 1063090761 C Bo:2:002:5 0 98 >
ffffffc07f122300 1064103939 S Bo:2:002:5 -115 98 = d286e6c7 8cfed286 e6c78cfe 08004500 00542ccc 40004001 4a8e0a58 a8e70808
ffffffc07f122300 1064104271 C Bo:2:002:5 0 98 >
ffffffc07f122a00 1065117087 S Bo:2:002:5 -115 98 = d286e6c7 8cfed286 e6c78cfe 08004500 00542d8f 40004001 49cb0a58 a8e70808
ffffffc07f122a00 1065117392 C Bo:2:002:5 0 98 >
ffffffc017941e00 1066130577 S Bo:2:002:5 -115 98 = d286e6c7 8cfed286 e6c78cfe 08004500 00542e67 40004001 48f30a58 a8e70808
ffffffc017941e00 1066130833 C Bo:2:002:5 0 98 >
ffffffc017941300 1067143832 S Bo:2:002:5 -115 98 = d286e6c7 8cfed286 e6c78cfe 08004500 00542f36 40004001 48240a58 a8e70808
ffffffc017941300 1067144073 C Bo:2:002:5 0 98 >
ffffffc017941900 1068157130 S Bo:2:002:5 -115 98 = d286e6c7 8cfed286 e6c78cfe 08004500 00543007 40004001 47530a58 a8e70808
ffffffc017941900 1068157324 C Bo:2:002:5 0 98 >
ffffffc017941800 1069170453 S Bo:2:002:5 -115 98 = d286e6c7 8cfed286 e6c78cfe 08004500 0054301a 40004001 47400a58 a8e70808
ffffffc017941800 1069170673 C Bo:2:002:5 0 98 >
ffffffc017941f00 1070183866 S Bo:2:002:5 -115 98 = d286e6c7 8cfed286 e6c78cfe 08004500 0054302d 40004001 472d0a58 a8e70808
ffffffc017941f00 1070184048 C Bo:2:002:5 0 98 >
ffffffc017941d00 1071197235 S Bo:2:002:5 -115 98 = d286e6c7 8cfed286 e6c78cfe 08004500 00543135 40004001 46250a58 a8e70808
ffffffc017941d00 1071197424 C Bo:2:002:5 0 98 >
ffffffc017941c00 1072210526 S Bo:2:002:5 -115 98 = d286e6c7 8cfed286 e6c78cfe 08004500 005431da 40004001 45800a58 a8e70808
ffffffc017941c00 1072210802 C Bo:2:002:5 0 98 >
ffffffc0643c5200 1072334024 S Bo:2:002:3 -115 7 = 41542b43 53510d
ffffffc0643c5200 1072334300 C Bo:2:002:3 0 7 >
ffffffc064299e00 1072338152 C Bi:2:002:4 0 21 = 0d0a2b43 53513a20 31372c39 390d0a0d 0a4f4b0d 0a
ffffffc064299e00 1072338221 S Bi:2:002:4 -115 4096 <
ffffffc0643c5200 1072339358 S Bo:2:002:3 -115 19 = 41542b43 4f50533d 332c323b 2b434f50 533f0d
ffffffc0643c5200 1072339538 C Bo:2:002:3 0 19 >
ffffffc064299f00 1072342613 C Bi:2:002:4 0 30 = 0d0a2b43 4f50533a 20302c32 2c223436 30303022 2c370d0a 0d0a4f4b 0d0a
ffffffc064299f00 1072342686 S Bi:2:002:4 -115 4096 <
ffffffc0643c5200 1072343802 S Bo:2:002:3 -115 8 = 41542b51 4353510d
ffffffc0643c5200 1072344057 C Bo:2:002:3 0 8 >
ffffffc0643c5000 1072345609 C Bi:2:002:4 0 38 = 0d0a2b51 4353513a 20224c54 45222c37 392c2d31 30352c31 35322c2d 31310d0a
ffffffc0643c5000 1072345678 S Bi:2:002:4 -115 4096 <
ffffffc0643c5200 1072347157 S Bo:2:002:3 -115 10 = 41542b43 47524547 3f0d
ffffffc0643c5200 1072347428 C Bo:2:002:3 0 10 >
ffffffc0643c5100 1072349574 C Bi:2:002:4 0 40 = 0d0a2b43 47524547 3a20322c 312c2231 31423222 2c223739 39363538 37222c37
ffffffc0643c5100 1072349682 S Bi:2:002:4 -115 4096 <
ffffffc064299b00 1072360161 C Ii:2:002:5 0:256 10 = a1200000 02000200 0000
ffffffc064299b00 1072360229 S Ii:2:002:5 -115:256 10 <
ffffffc064299b00 1072392172 C Ii:2:002:5 0:256 10 = a1200000 02000200 0000
ffffffc064299b00 1072392238 S Ii:2:002:5 -115:256 10 <
ffffffc017941c00 1073223934 S Bo:2:002:5 -115 98 = d286e6c7 8cfed286 e6c78cfe 08004500 00543204 40004001 45560a58 a8e70808
ffffffc017941c00 1073224265 C Bo:2:002:5 0 98 >
ffffffc017941d00 1074237291 S Bo:2:002:5 -115 98 = d286e6c7 8cfed286 e6c78cfe 08004500 005432c0 40004001 449a0a58 a8e70808
ffffffc017941d00 1074237565 C Bo:2:002:5 0 98 >
ffffffc017941f00 1075250563 S Bo:2:002:5 -115 98 = d286e6c7 8cfed286 e6c78cfe 08004500 00543381 40004001 43d90a58 a8e70808
ffffffc017941f00 1075250836 C Bo:2:002:5 0 98 >
ffffffc017941800 1076263916 S Bo:2:002:5 -115 98 = d286e6c7 8cfed286 e6c78cfe 08004500 00543386 40004001 43d40a58 a8e70808
ffffffc017941800 1076264185 C Bo:2:002:5 0 98 >
ffffffc017941900 1077277171 S Bo:2:002:5 -115 98 = d286e6c7 8cfed286 e6c78cfe 08004500 005434b2 40004001 42a80a58 a8e70808
ffffffc017941900 1077277426 C Bo:2:002:5 0 98 >
ffffffc017941300 1078290508 S Bo:2:002:5 -115 98 = d286e6c7 8cfed286 e6c78cfe 08004500 00543536 40004001 42240a58 a8e70808
ffffffc017941300 1078290676 C Bo:2:002:5 0 98 >
ffffffc017941e00 1079303782 S Bo:2:002:5 -115 98 = d286e6c7 8cfed286 e6c78cfe 08004500 0054356a 40004001 41f00a58 a8e70808
ffffffc017941e00 1079304058 C Bo:2:002:5 0 98 >
ffffffc017941400 1080317081 S Bo:2:002:5 -115 98 = d286e6c7 8cfed286 e6c78cfe 08004500 0054361b 40004001 413f0a58 a8e70808
ffffffc017941400 1080317300 C Bo:2:002:5 0 98 >
ffffffc017941600 1081330579 S Bo:2:002:5 -115 98 = d286e6c7 8cfed286 e6c78cfe 08004500 00543691 40004001 40c90a58 a8e70808
ffffffc017941600 1081330808 C Bo:2:002:5 0 98 >
ffffffc017941200 1082343854 S Bo:2:002:5 -115 98 = d286e6c7 8cfed286 e6c78cfe 08004500 00543721 40004001 40390a58 a8e70808
ffffffc017941200 1082344053 C Bo:2:002:5 0 98 >
ffffffc017941600 1083357287 S Bo:2:002:5 -115 98 = d286e6c7 8cfed286 e6c78cfe 08004500 005437c7 40004001 3f930a58 a8e70808
ffffffc017941600 1083357643 C Bo:2:002:5 0 98 >
ffffffc024562000 1084370593 S Bo:2:002:5 -115 98 = d286e6c7 8cfed286 e6c78cfe 08004500 00543838 40004001 3f220a58 a8e70808
ffffffc024562000 1084370814 C Bo:2:002:5 0 98 >
ffffffc0643c5200 1092371321 S Bo:2:002:3 -115 7 = 41542b43 53510d
ffffffc0643c5200 1092371558 C Bo:2:002:3 0 7 >
ffffffc064299e00 1092376032 C Bi:2:002:4 0 21 = 0d0a2b43 53513a20 31372c39 390d0a0d 0a4f4b0d 0a
ffffffc064299e00 1092376100 S Bi:2:002:4 -115 4096 <
ffffffc0643c5200 1092377295 S Bo:2:002:3 -115 19 = 41542b43 4f50533d 332c323b 2b434f50 533f0d
ffffffc0643c5200 1092377627 C Bo:2:002:3 0 19 >
ffffffc064299f00 1092381740 C Bi:2:002:4 0 30 = 0d0a2b43 4f50533a 20302c32 2c223436 30303022 2c370d0a 0d0a4f4b 0d0a
ffffffc064299f00 1092381814 S Bi:2:002:4 -115 4096 <
ffffffc0643c5200 1092382826 S Bo:2:002:3 -115 8 = 41542b51 4353510d
ffffffc0643c5200 1092383037 C Bo:2:002:3 0 8 >
ffffffc0643c5000 1092384154 C Bi:2:002:4 0 38 = 0d0a2b51 4353513a 20224c54 45222c37 392c2d31 30352c31 35352c2d 31310d0a
ffffffc0643c5000 1092384215 S Bi:2:002:4 -115 4096 <
ffffffc0643c5200 1092385552 S Bo:2:002:3 -115 10 = 41542b43 47524547 3f0d
ffffffc0643c5200 1092385793 C Bo:2:002:3 0 10 >
ffffffc0643c5100 1092386914 C Bi:2:002:4 0 40 = 0d0a2b43 47524547 3a20322c 312c2231 31423222 2c223739 39363538 37222c37
ffffffc0643c5100 1092386996 S Bi:2:002:4 -115 4096 <
ffffffc064299b00 1092392084 C Ii:2:002:5 0:256 10 = a1200000 02000200 0000
ffffffc064299b00 1092392144 S Ii:2:002:5 -115:256 10 <
ffffffc064299b00 1092424058 C Ii:2:002:5 0:256 10 = a1200000 02000200 0000
ffffffc064299b00 1092424119 S Ii:2:002:5 -115:256 10 <
ffffffc0643c5200 1112390663 S Bo:2:002:3 -115 7 = 41542b43 53510d
ffffffc0643c5200 1112390933 C Bo:2:002:3 0 7 >
ffffffc064299e00 1112395620 C Bi:2:002:4 0 21 = 0d0a2b43 53513a20 31372c39 390d0a0d 0a4f4b0d 0a
ffffffc064299e00 1112395716 S Bi:2:002:4 -115 4096 <
ffffffc0643c5200 1112396784 S Bo:2:002:3 -115 19 = 41542b43 4f50533d 332c323b 2b434f50 533f0d
ffffffc0643c5200 1112396905 C Bo:2:002:3 0 19 >
ffffffc064299f00 1112406611 C Bi:2:002:4 0 30 = 0d0a2b43 4f50533a 20302c32 2c223436 30303022 2c370d0a 0d0a4f4b 0d0a
ffffffc064299f00 1112406678 S Bi:2:002:4 -115 4096 <
ffffffc0643c5200 1112407597 S Bo:2:002:3 -115 8 = 41542b51 4353510d
ffffffc0643c5200 1112407808 C Bo:2:002:3 0 8 >
ffffffc0643c5000 1112413991 C Bi:2:002:4 0 38 = 0d0a2b51 4353513a 20224c54 45222c37 392c2d31 30352c31 35372c2d 31310d0a
ffffffc0643c5000 1112414062 S Bi:2:002:4 -115 4096 <
ffffffc0643c5200 1112415425 S Bo:2:002:3 -115 10 = 41542b43 47524547 3f0d
ffffffc0643c5200 1112415741 C Bo:2:002:3 0 10 >
ffffffc0643c5100 1112421952 C Bi:2:002:4 0 40 = 0d0a2b43 47524547 3a20322c 312c2231 31423222 2c223739 39363538 37222c37
ffffffc0643c5100 1112422079 S Bi:2:002:4 -115 4096 <
ffffffc064299b00 1112424158 C Ii:2:002:5 0:256 10 = a1200000 02000200 0000
ffffffc064299b00 1112424226 S Ii:2:002:5 -115:256 10 <
ffffffc064299b00 1112456070 C Ii:2:002:5 0:256 10 = a1200000 02000200 0000
ffffffc064299b00 1112456123 S Ii:2:002:5 -115:256 10 <
ffffffc0643c5200 1132430623 S Bo:2:002:3 -115 7 = 41542b43 53510d
ffffffc0643c5200 1132430807 C Bo:2:002:3 0 7 >
ffffffc064299e00 1132437625 C Bi:2:002:4 0 21 = 0d0a2b43 53513a20 31372c39 390d0a0d 0a4f4b0d 0a
ffffffc064299e00 1132437705 S Bi:2:002:4 -115 4096 <
ffffffc0643c5200 1132438775 S Bo:2:002:3 -115 19 = 41542b43 4f50533d 332c323b 2b434f50 533f0d
ffffffc0643c5200 1132438917 C Bo:2:002:3 0 19 >
ffffffc064299f00 1132445117 C Bi:2:002:4 0 30 = 0d0a2b43 4f50533a 20302c32 2c223436 30303022 2c370d0a 0d0a4f4b 0d0a
ffffffc064299f00 1132445187 S Bi:2:002:4 -115 4096 <
ffffffc0643c5200 1132446126 S Bo:2:002:3 -115 8 = 41542b51 4353510d
ffffffc0643c5200 1132446297 C Bo:2:002:3 0 8 >
ffffffc0643c5000 1132453120 C Bi:2:002:4 0 38 = 0d0a2b51 4353513a 20224c54 45222c37 392c2d31 30352c31 35352c2d 31310d0a
ffffffc0643c5000 1132453187 S Bi:2:002:4 -115 4096 <
ffffffc0643c5200 1132454512 S Bo:2:002:3 -115 10 = 41542b43 47524547 3f0d
ffffffc0643c5200 1132454682 C Bo:2:002:3 0 10 >
ffffffc064299b00 1132456068 C Ii:2:002:5 0:256 10 = a1200000 02000200 0000
ffffffc064299b00 1132456122 S Ii:2:002:5 -115:256 10 <
ffffffc0643c5100 1132460824 C Bi:2:002:4 0 40 = 0d0a2b43 47524547 3a20322c 312c2231 31423222 2c223739 39363538 37222c37
ffffffc0643c5100 1132460948 S Bi:2:002:4 -115 4096 <
ffffffc064299b00 1132488173 C Ii:2:002:5 0:256 10 = a1200000 02000200 0000
ffffffc064299b00 1132488261 S Ii:2:002:5 -115:256 10 <
ffffffc064299b00 1132520133 C Ii:2:002:5 0:256 10 = a1200000 02000200 0000
ffffffc064299b00 1132520192 S Ii:2:002:5 -115:256 10 <
